question,answer
What programs do you offer?,We offer programs in Artificial Intelligence Computer Science and Data Science
What documents are required for admission?,You need transcripts passport copy English test and recommendation letters
Is IELTS required?,Yes IELTS or TOEFL is required for international students
What is the application deadline?,The application deadline is July 30
Do you offer scholarships?,Yes we offer merit based scholarships
Where is the university located?,The university is located in Beijing China
How can I apply?,You can apply online through the university admission portal
What is the tuition fee?,The tuition fee varies by program but averages around 5000 dollars per year
Do you offer AI programs?,Yes we offer Bachelor and Master programs in Artificial Intelligence
Is hostel available?,Yes university hostel accommodation is available
What is the minimum GPA required?,Minimum GPA required is 3.0
Do you accept international students?,Yes international students are welcome
What English tests are accepted?,We accept IELTS TOEFL and Duolingo
How long is the AI program?,The AI program duration is four years
Do you provide internships?,Yes many programs include internship opportunities
Is there an application fee?,Yes the application fee is 50 dollars
Can I apply without IELTS?,Some universities allow admission without IELTS depending on your previous education
What is the admission process?,Submit application documents and wait for admission decision
When does the semester start?,The fall semester starts in September
Can I study Data Science?,Yes Data Science program is available
What programs do you offer?,We offer programs in Artificial Intelligence Computer Science and Data Science
What documents are required?,You need transcripts passport English test and recommendation letters
Do you offer scholarships?,Yes merit based scholarships are available
What is the application deadline?,The deadline is July 30
Is IELTS required?,Yes IELTS or TOEFL is required
Do you accept international students?,Yes international students are welcome
Is hostel available?,Yes university hostel accommodation is available
What is the tuition fee?,Average tuition fee is around 5000 dollars per year
How long is the AI program?,The AI program duration is four years
Can I apply online?,Yes you can apply through the university admission portal
